id,doi,originalTitle,title,authorString,authorAffiliations,journalTitle,pubYear,isOpenAccess,keywords,nationalPriorities,healthCategories,abstract,urls
31152163,https://doi.org/10.1038/s41588-019-0407-x,A catalog of genetic loci associated with kidney function from analyses of a million individuals,A catalog of genetic loci associated with kidney function from analyses of a million individuals.,"Wuttke M, Li Y, Li M, Sieber KB, Feitosa MF, Gorski M, Tin A, Wang L, Chu AY, Hoppmann A, Kirsten H, Giri A, Chai JF, Sveinbjornsson G, Tayo BO, Nutile T, Fuchsberger C, Marten J, Cocca M, Ghasemi S, Xu Y, Horn K, Noce D, van der Most PJ, Sedaghat S, Yu Z, Akiyama M, Afaq S, Ahluwalia TS, Almgren P, Amin N, Ärnlöv J, Bakker SJL, Bansal N, Baptista D, Bergmann S, Biggs ML, Biino G, Boehnke M, Boerwinkle E, Boissel M, Bottinger EP, Boutin TS, Brenner H, Brumat M, Burkhardt R, Butterworth AS, Campana E, Campbell A, Campbell H, Canouil M, Carroll RJ, Catamo E, Chambers JC, Chee ML, Chee ML, Chen X, Cheng CY, Cheng Y, Christensen K, Cifkova R, Ciullo M, Concas MP, Cook JP, Coresh J, Corre T, Sala CF, Cusi D, Danesh J, Daw EW, de Borst MH, De Grandi A, de Mutsert R, de Vries APJ, Degenhardt F, Delgado G, Demirkan A, Di Angelantonio E, Dittrich K, Divers J, Dorajoo R, Eckardt KU, Ehret G, Elliott P, Endlich K, Evans MK, Felix JF, Foo VHX, Franco OH, Franke A, Freedman BI, Freitag-Wolf S, Friedlander Y, Froguel P, Gansevoort RT, Gao H, Gasparini P, Gaziano JM, Giedraitis V, Gieger C, Girotto G, Giulianini F, Gögele M, Gordon SD, Gudbjartsson DF, Gudnason V, Haller T, Hamet P, Harris TB, Hartman CA, Hayward C, Hellwege JN, Heng CK, Hicks AA, Hofer E, Huang W, Hutri-Kähönen N, Hwang SJ, Ikram MA, Indridason OS, Ingelsson E, Ising M, Jaddoe VWV, Jakobsdottir J, Jonas JB, Joshi PK, Josyula NS, Jung B, Kähönen M, Kamatani Y, Kammerer CM, Kanai M, Kastarinen M, Kerr SM, Khor CC, Kiess W, Kleber ME, Koenig W, Kooner JS, Körner A, Kovacs P, Kraja AT, Krajcoviechova A, Kramer H, Krämer BK, Kronenberg F, Kubo M, Kühnel B, Kuokkanen M, Kuusisto J, La Bianca M, Laakso M, Lange LA, Langefeld CD, Lee JJ, Lehne B, Lehtimäki T, Lieb W, Lifelines Cohort Study, Lim SC, Lind L, Lindgren CM, Liu J, Liu J, Loeffler M, Loos RJF, Lucae S, Lukas MA, Lyytikäinen LP, Mägi R, Magnusson PKE, Mahajan A, Martin NG, Martins J, März W, Mascalzoni D, Matsuda K, Meisinger C, Meitinger T, Melander O, Metspalu A, Mikaelsdottir EK, Milaneschi Y, Miliku K, Mishra PP, V. A. Million Veteran Program, Mohlke KL, Mononen N, Montgomery GW, Mook-Kanamori DO, Mychaleckyj JC, Nadkarni GN, Nalls MA, Nauck M, Nikus K, Ning B, Nolte IM, Noordam R, O'Connell J, O'Donoghue ML, Olafsson I, Oldehinkel AJ, Orho-Melander M, Ouwehand WH, Padmanabhan S, Palmer ND, Palsson R, Penninx BWJH, Perls T, Perola M, Pirastu M, Pirastu N, Pistis G, Podgornaia AI, Polasek O, Ponte B, Porteous DJ, Poulain T, Pramstaller PP, Preuss MH, Prins BP, Province MA, Rabelink TJ, Raffield LM, Raitakari OT, Reilly DF, Rettig R, Rheinberger M, Rice KM, Ridker PM, Rivadeneira F, Rizzi F, Roberts DJ, Robino A, Rossing P, Rudan I, Rueedi R, Ruggiero D, Ryan KA, Saba Y, Sabanayagam C, Salomaa V, Salvi E, Saum KU, Schmidt H, Schmidt R, Schöttker B, Schulz CA, Schupf N, Shaffer CM, Shi Y, Smith AV, Smith BH, Soranzo N, Spracklen CN, Strauch K, Stringham HM, Stumvoll M, Svensson PO, Szymczak S, Tai ES, Tajuddin SM, Tan NYQ, Taylor KD, Teren A, Tham YC, Thiery J, Thio CHL, Thomsen H, Thorleifsson G, Toniolo D, Tönjes A, Tremblay J, Tzoulaki I, Uitterlinden AG, Vaccargiu S, van Dam RM, van der Harst P, van Duijn CM, Velez Edward DR, Verweij N, Vogelezang S, Völker U, Vollenweider P, Waeber G, Waldenberger M, Wallentin L, Wang YX, Wang C, Waterworth DM, Bin Wei W, White H, Whitfield JB, Wild SH, Wilson JF, Wojczynski MK, Wong C, Wong TY, Xu L, Yang Q, Yasuda M, Yerges-Armstrong LM, Zhang W, Zonderman AB, Rotter JI, Bochud M, Psaty BM, Vitart V, Wilson JG, Dehghan A, Parsa A, Chasman DI, Ho K, Morris AP, Devuyst O, Akilesh S, Pendergrass SA, Sim X, Böger CA, Okada Y, Edwards TL, Snieder H, Stefansson K, Hung AM, Heid IM, Scholz M, Teumer A, Köttgen A, Pattaro C.",,Nature genetics,2019,N,,Understanding the Causes of Disease,,"Chronic kidney disease (CKD) is responsible for a public health burden with multi-systemic complications. Through trans-ancestry meta-analysis of genome-wide association studies of estimated glomerular filtration rate (eGFR) and independent replication (n = 1,046,070), we identified 264 associated loci (166 new). Of these, 147 were likely to be relevant for kidney function on the basis of associations with the alternative kidney function marker blood urea nitrogen (n = 416,178). Pathway and enrichment analyses, including mouse models with renal phenotypes, support the kidney as the main target organ. A genetic risk score for lower eGFR was associated with clinically diagnosed CKD in 452,264 independent individuals. Colocalization analyses of associations with eGFR among 783,978 European-ancestry individuals and gene expression across 46 human tissues, including tubulo-interstitial and glomerular kidney compartments, identified 17 genes differentially expressed in kidney. Fine-mapping highlighted missense driver variants in 11 genes and kidney-specific regulatory variants. These results provide a comprehensive priority list of molecular targets for translational research.",doi:https://doi.org/10.1038/s41588-019-0407-x; html:https://europepmc.org/articles/PMC6698888; pdf:https://europepmc.org/articles/PMC6698888?pdf=render; doi:https://doi.org/10.1038/s41588-019-0407-x
31408153,https://doi.org/10.1093/europace/euz220,"Subtypes of atrial fibrillation with concomitant valvular heart disease derived from electronic health records: phenotypes, population prevalence, trends and prognosis","Subtypes of atrial fibrillation with concomitant valvular heart disease derived from electronic health records: phenotypes, population prevalence, trends and prognosis.","Banerjee A, Allan V, Denaxas S, Shah A, Kotecha D, Lambiase PD, Joseph J, Lund LH, Hemingway H.",,"Europace : European pacing, arrhythmias, and cardiac electrophysiology : journal of the working groups on cardiac pacing, arrhythmias, and cardiac cellular electrophysiology of the European Society of Cardiology",2019,Y,Mortality; Atrial fibrillation; Stroke; Valvular Heart Disease; Electronic Health Records; Systemic Embolism,The Human Phenome,,"AIMS:To evaluate population-based electronic health record (EHR) definitions of atrial fibrillation (AF) and valvular heart disease (VHD) subtypes, time trends in prevalence and prognosis. METHODS AND RESULTS:A total of 76 019 individuals with AF were identified in England in 1998-2010 in the CALIBER resource, linking primary and secondary care EHR. An algorithm was created, implemented, and refined to identify 18 VHD subtypes using 406 diagnosis, procedure, and prescription codes. Cox models were used to investigate associations with a composite endpoint of incident stroke (ischaemic, haemorrhagic, and unspecified), systemic embolism (SSE), and all-cause mortality. Among individuals with AF, the prevalence of AF with concomitant VHD increased from 11.4% (527/4613) in 1998 to 17.6% (7014/39 868) in 2010 and also in individuals aged over 65 years. Those with mechanical valves, mitral stenosis (MS), or aortic stenosis had highest risk of clinical events compared to AF patients with no VHD, in relative [hazard ratio (95% confidence interval): 1.13 (1.02-1.24), 1.20 (1.05-1.36), and 1.27 (1.19-1.37), respectively] and absolute (excess risk: 2.04, 4.20, and 6.37 per 100 person-years, respectively) terms. Of the 95.2% of individuals with indication for warfarin (men and women with CHA2DS2-VASc ≥1 and ≥2, respectively), only 21.8% had a prescription 90 days prior to the study. CONCLUSION:Prevalence of VHD among individuals with AF increased from 1998 to 2010. Atrial fibrillation associated with aortic stenosis, MS, or mechanical valves (compared to AF without VHD) was associated with an excess absolute risk of stroke, SSE, and mortality, but anticoagulation was underused in the pre-direct oral anticoagulant (DOAC) era, highlighting need for urgent clarity regarding DOACs in AF and concomitant VHD.",doi:https://doi.org/10.1093/europace/euz220; html:https://europepmc.org/articles/PMC6888023; pdf:https://europepmc.org/articles/PMC6888023?pdf=render
31409800,https://doi.org/10.1038/s41467-019-11451-y,GWAS for urinary sodium and potassium excretion highlights pathways shared with cardiovascular traits,GWAS for urinary sodium and potassium excretion highlights pathways shared with cardiovascular traits.,"Pazoki R, Evangelou E, Mosen-Ansorena D, Pinto RC, Karaman I, Blakeley P, Gill D, Zuber V, Elliott P, Tzoulaki I, Dehghan A.",,Nature communications,2019,Y,,Understanding the Causes of Disease,,"Urinary sodium and potassium excretion are associated with blood pressure (BP) and cardiovascular disease (CVD). The exact biological link between these traits is yet to be elucidated. Here, we identify 50 loci for sodium and 13 for potassium excretion in a large-scale genome-wide association study (GWAS) on urinary sodium and potassium excretion using data from 446,237 individuals of European descent from the UK Biobank study. We extensively interrogate the results using multiple analyses such as Mendelian randomization, functional assessment, co localization, genetic risk score, and pathway analyses. We identify a shared genetic component between urinary sodium and potassium expression and cardiovascular traits. Ingenuity pathway analysis shows that urinary sodium and potassium excretion loci are over-represented in behavioural response to stimuli. Our study highlights pathways that are shared between urinary sodium and potassium excretion and cardiovascular traits.",doi:https://doi.org/10.1038/s41467-019-11451-y; html:https://europepmc.org/articles/PMC6692500; pdf:https://europepmc.org/articles/PMC6692500?pdf=render
31398202,https://doi.org/10.1371/journal.pone.0220771,The role of health and social factors in education outcome: A record-linked electronic birth cohort analysis,The role of health and social factors in education outcome: A record-linked electronic birth cohort analysis.,"Evans A, Dunstan F, Fone DL, Bandyopadhyay A, Schofield B, Demmler JC, Rahman MA, Lyons RA, Paranjothy S.",,PloS one,2019,Y,,Improving Public Health,,"BACKGROUND AND OBJECTIVE:Health status in childhood is correlated with educational outcomes. Emergency hospital admissions during childhood are common but it is not known how these unplanned breaks from schooling impact on education outcomes. We hypothesised that children who had emergency hospital admissions had an increased risk of lower educational attainment, in addition to the increased risks associated with other health, social and school factors. METHODS:This record-linked electronic birth cohort, included children born in Wales between 1 January 1998 and 31 August 2001. We fitted multilevel logistic regression models grouped by schools, to determine whether emergency hospital inpatient admission before age 7 years was associated with the educational outcome of not attaining the expected level in a teacher-based assessment at age 7 years (KS1). We adjusted for pregnancy, perinatal, socio-economic, neighbourhood, pupil mobility and school-level factors. RESULTS:The cohort comprised 64 934 children. Overall, 4680 (7.2%) did not attain the expected educational level. Emergency admission to hospital was associated with poor educational attainment (OR 1.12 95% Credible Interval (CI) 1.05, 1.20 for all causes during childhood, OR 1.19 95%CI 1.07, 1.32 for injuries and external causes and OR 1.31 95%CI 1.04, 1.22 for admissions during infancy), after adjusting for known determinants of education outcomes such as extreme prematurity, being small for gestational age and socio-economic indicators, such as eligibility for free school meals. CONCLUSION:Emergency inpatient hospital admission during childhood, particularly during infancy or for injuries and external causes was associated with an increased risk of lower education attainment at age 7 years, in addition to the effects of pregnancy factors (gestational age, birthweight) and social deprivation. These findings support the need for injury prevention measures and additional support in school for affected children to help them to achieve their potential.",doi:https://doi.org/10.1371/journal.pone.0220771; html:https://europepmc.org/articles/PMC6688802; pdf:https://europepmc.org/articles/PMC6688802?pdf=render
31398891,https://doi.org/10.3390/nu11081839,Intakes and Food Sources of Dietary Fibre and Their Associations with Measures of Body Composition and Inflammation in UK Adults: Cross-Sectional Analysis of the Airwave Health Monitoring Study,Intakes and Food Sources of Dietary Fibre and Their Associations with Measures of Body Composition and Inflammation in UK Adults: Cross-Sectional Analysis of the Airwave Health Monitoring Study.,"Gibson R, Eriksen R, Chambers E, Gao H, Aresu M, Heard A, Chan Q, Elliott P, Frost G.",,Nutrients,2019,Y,Body composition; body mass index; Dietary fibre; C-reactive Protein; Waist Circumference; Uk Population; Airwave Health Monitoring Study; Food Sources Fibre,Improving Public Health,,"The purpose of this study was to investigate the associations between intakes of fibre from the main food sources of fibre in the UK diet with body mass index (BMI), percentage body fat (%BF), waist circumference (WC) and C-reactive protein (CRP). Participants enrolled in the Airwave Health Monitoring Study (2007-2012) with 7-day food records (n = 6898; 61% men) were included for cross-sectional analyses. General linear models evaluated associations across fifths of fibre intakes (total, vegetable, fruit, potato, whole grain and non-whole grain cereal) with BMI, %BF, WC and CRP. Fully adjusted analyses showed inverse linear trends across fifths of total fibre and fibre from fruit with all outcome measures (ptrend < 0.0001). Vegetable fibre intake showed an inverse association with WC (ptrend 0.0156) and CRP (ptrend 0.0005). Fibre from whole grain sources showed an inverse association with BMI (ptrend 0.0002), %BF (ptrend 0.0007) and WC (ptrend 0.0004). Non-whole grain cereal fibre showed an inverse association with BMI (Ptrend 0.0095). Direct associations observed between potato fibre intake and measures of body composition and inflammation were attenuated in fully adjusted analyses controlling for fried potato intake. Higher fibre intake has a beneficial association on body composition, however, there are differential associations based on the food source.",doi:https://doi.org/10.3390/nu11081839; html:https://europepmc.org/articles/PMC6722677; pdf:https://europepmc.org/articles/PMC6722677?pdf=render
31382511,https://doi.org/10.3390/toxins11080454,Indoxyl Sulfate Stimulates Angiogenesis by Regulating Reactive Oxygen Species Production via CYP1B1,Indoxyl Sulfate Stimulates Angiogenesis by Regulating Reactive Oxygen Species Production via CYP1B1.,"Pei J, Juni R, Harakalova M, Duncker DJ, Asselbergs FW, Koolwijk P, Hinsbergh VV, Verhaar MC, Mokry M, Cheng C.",,Toxins,2019,Y,Reactive oxygen species; Angiogenesis; Chronic Kidney Disease; Cyp1b1; Indoxyl Sulfate,Understanding the Causes of Disease,,"Indoxyl sulfate (IS) is an accumulative protein-bound uremic toxin found in patients with kidney disease. It is reported that IS impairs the vascular endothelium, but a comprehensive overview of all mechanisms active in IS-injury currently remains lacking. Here we performed RNA sequencing in human umbilical vein endothelial cells (HUVECs) after IS or control medium treatment and identified 1293 genes that were affected in a IS-induced response. Gene enrichment analysis highlighted pathways involved in altered vascular formation and cell metabolism. We confirmed these transcriptome profiles at the functional level by demonstrating decreased viability and increased cell senescence in response to IS treatment. In line with the additional pathways highlighted by the transcriptome analysis, we further could demonstrate that IS exposure of HUVECs promoted tubule formation as shown by the increase in total tubule length in a 3D HUVECs/pericytes co-culture assay. Notably, the pro-angiogenic response of IS and increased ROS production were abolished when CYP1B1, one of the main target genes that was highly upregulated by IS, was silenced. This observation indicates IS-induced ROS in endothelial cells is CYP1B1-dependent. Taken together, our findings demonstrate that IS promotes angiogenesis and CYP1B1 is an important factor in IS-activated angiogenic response.",doi:https://doi.org/10.3390/toxins11080454; html:https://europepmc.org/articles/PMC6723868; pdf:https://europepmc.org/articles/PMC6723868?pdf=render
31619084,https://doi.org/10.1177/2047487319877078,Progression of conventional cardiovascular risk factors and vascular disease risk in individuals: insights from the PROG-IMT consortium.,Progression of conventional cardiovascular risk factors and vascular disease risk in individuals: insights from the PROG-IMT consortium.,"Bahls M, Lorenz MW, Dörr M, Gao L, Kitagawa K, Tuomainen TP, Agewall S, Berenson G, Catapano AL, Norata GD, Bots ML, van Gilst W, Asselbergs FW, Brouwers FP, Uthoff H, Sander D, Poppert H, Hecht Olsen M, Empana JP, Schminke U, Baldassarre D, Veglia F, Franco OH, Kavousi M, de Groot E, Mathiesen EB, Grigore L, Polak JF, Rundek T, Stehouwer CD, Skilton MR, Hatzitolios AI, Savopoulos C, Ntaios G, Plichart M, McLachlan S, Lind L, Willeit P, Steinmetz H, Desvarieux M, Ikram MA, Johnsen SH, Schmidt C, Willeit J, Ducimetiere P, Price JF, Bergström G, Kauhanen J, Kiechl S, Sitzer M, Bickel H, Sacco RL, Hofman A, Völzke H, Thompson SG, PROG-IMT Study Group.",,European journal of preventive cardiology,2020,Y,risk factors; Cvd Biomarker; Risk Factor Progression,,cardiovascular,"AIMS:Averaged measurements, but not the progression based on multiple assessments of carotid intima-media thickness, (cIMT) are predictive of cardiovascular disease (CVD) events in individuals. Whether this is true for conventional risk factors is unclear. METHODS AND RESULTS:An individual participant meta-analysis was used to associate the annualised progression of systolic blood pressure, total cholesterol, low-density lipoprotein cholesterol and high-density lipoprotein cholesterol with future cardiovascular disease risk in 13 prospective cohort studies of the PROG-IMT collaboration (n = 34,072). Follow-up data included information on a combined cardiovascular disease endpoint of myocardial infarction, stroke, or vascular death. In secondary analyses, annualised progression was replaced with average. Log hazard ratios per standard deviation difference were pooled across studies by a random effects meta-analysis. In primary analysis, the annualised progression of total cholesterol was marginally related to a higher cardiovascular disease risk (hazard ratio (HR) 1.04, 95% confidence interval (CI) 1.00 to 1.07). The annualised progression of systolic blood pressure, low-density lipoprotein cholesterol and high-density lipoprotein cholesterol was not associated with future cardiovascular disease risk. In secondary analysis, average systolic blood pressure (HR 1.20 95% CI 1.11 to 1.29) and low-density lipoprotein cholesterol (HR 1.09, 95% CI 1.02 to 1.16) were related to a greater, while high-density lipoprotein cholesterol (HR 0.92, 95% CI 0.88 to 0.97) was related to a lower risk of future cardiovascular disease events. CONCLUSION:Averaged measurements of systolic blood pressure, low-density lipoprotein cholesterol and high-density lipoprotein cholesterol displayed significant linear relationships with the risk of future cardiovascular disease events. However, there was no clear association between the annualised progression of these conventional risk factors in individuals with the risk of future clinical endpoints.",doi:https://doi.org/10.1177/2047487319877078; html:https://europepmc.org/articles/PMC7008553; pdf:https://europepmc.org/articles/PMC7008553?pdf=render
31442537,https://doi.org/10.1016/j.jaad.2019.08.039,Atopic dermatitis and risk of atrial fibrillation or flutter: a 35-year follow-up study,Atopic dermatitis and risk of atrial fibrillation or flutter: A 35-year follow-up study.,"Schmidt SAJ, Olsen M, Schmidt M, Vestergaard C, Langan SM, Deleuran MS, Riis JL.",,Journal of the American Academy of Dermatology,2019,N,Validation; Atrial fibrillation; Atrial flutter; Cohort study; risk factors; Atopic Dermatitis,Understanding the Causes of Disease,,"BACKGROUND:Atopic dermatitis is characterized by chronic inflammation, which is a risk factor for atrial fibrillation. OBJECTIVE:To examine the association between hospital-diagnosed atopic dermatitis and atrial fibrillation. METHODS:Using linked population-based Danish registries, we identified persons with an inpatient or outpatient hospital diagnosis of atopic dermatitis during 1977-2013 and a comparison cohort individually matched to the atopic dermatitis cohort. We followed cohorts until death, emigration, atrial fibrillation diagnosis, or end of study (January 1, 2013). We compared 35-year risk of atrial fibrillation and estimated hazard ratios with 95% confidence intervals using Cox regression, adjusting for birth year and sex. We validated 100 atopic dermatitis diagnoses from a dermatologic department through medical record review. RESULTS:We included 13,126 persons with atopic dermatitis and 124,211 comparators and followed them for a median of 19.3 years. The 35-year risk of atrial fibrillation was 0.81% and 0.67%, respectively. The positive predictive value of atopic dermatitis diagnoses was 99%. The hazard ratio was 1.2 (95% confidence interval 1.0-1.6) and remained increased after adjusting for various atrial fibrillation risk factors. LIMITATIONS:Analyses were limited to persons with moderate-to-severe atopic dermatitis, and we had no lifestyle data. CONCLUSION:Patients with hospital-diagnosed atopic dermatitis have a 20% increased long-term risk of atrial fibrillation, but the absolute risk remains low.",doi:https://doi.org/10.1016/j.jaad.2019.08.039
31353050,https://doi.org/10.1016/s0140-6736(19)31359-5,Eligibility and subsequent burden of cardiovascular disease of four strategies for blood pressure-lowering treatment: a retrospective cohort study,Eligibility and subsequent burden of cardiovascular disease of four strategies for blood pressure-lowering treatment: a retrospective cohort study.,"Herrett E, Gadd S, Jackson R, Bhaskaran K, Williamson E, van Staa T, Sofat R, Timmis A, Smeeth L.",,"Lancet (London, England)",2019,Y,,Better Care,,"BACKGROUND:Worldwide treatment recommendations for lowering blood pressure continue to be guided predominantly by blood pressure thresholds, despite strong evidence that the benefits of blood pressure reduction are observed in patients across the blood pressure spectrum. In this study, we aimed to investigate the implications of alternative strategies for offering blood pressure treatment, using the UK as an illustrative example. METHODS:We did a retrospective cohort study in primary care patients aged 30-79 years without cardiovascular disease, using data from the UK's Clinical Practice Research Datalink linked to Hospital Episode Statistics and Office for National Statistics mortality. We assessed and compared four different strategies to determine eligibility for treatment: using 2011 UK National Institute for Health and Care Excellence (NICE) guideline, or proposed 2019 NICE guideline, or blood pressure alone (threshold ≥140/90 mm Hg), or predicted 10-year cardiovascular risk alone (QRISK2 score ≥10%). Patients were followed up until the earliest occurrence of a cardiovascular disease diagnosis, death, or end of follow-up period (March 31, 2016). For each strategy, we estimated the proportion of patients eligible for treatment and number of cardiovascular events that could be prevented with treatment. We then estimated eligibility and number of events that would occur during 10 years in the UK general population. FINDINGS:Between Jan 1, 2011, and March 31, 2016, 1 222 670 patients in the cohort were followed up for a median of 4·3 years (IQR 2·5-5·2). 271 963 (22·2%) patients were eligible for treatment under the 2011 NICE guideline, 327 429 (26·8%) under the proposed 2019 NICE guideline, 481 859 (39·4%) on the basis of a blood pressure threshold of 140/90 mm Hg or higher, and 357 840 (29·3%) on the basis of a QRISK2 threshold of 10% or higher. During follow-up, 32 183 patients were diagnosed with cardiovascular disease (overall rate 7·1 per 1000 person-years, 95% CI 7·0-7·2). Cardiovascular event rates in patients eligible for each strategy were 15·2 per 1000 person-years (95% CI 15·0-15·5) under the 2011 NICE guideline, 14·9 (14·7-15·1) under the proposed 2019 NICE guideline, 11·4 (11·3-11·6) with blood pressure threshold alone, and 16·9 (16·7-17·1) with QRISK2 threshold alone. Scaled to the UK population, we estimated that 233 152 events would be avoided under the 2011 NICE guideline (28 patients needed to treat for 10 years to avoid one event), 270 233 under the 2019 NICE guideline (29 patients), 301 523 using a blood pressure threshold (38 patients), and 322 921 using QRISK2 threshold (27 patients). INTERPRETATION:A cardiovascular risk-based strategy (QRISK2 ≥10%) could prevent over a third more cardiovascular disease events than the 2011 NICE guideline and a fifth more than the 2019 NICE guideline, with similar efficiency regarding number treated per event avoided. FUNDING:National Institute for Health Research.",doi:https://doi.org/10.1016/S0140-6736(19)31359-5; html:https://europepmc.org/articles/PMC6717081
