id,doi,originalTitle,title,authorString,authorAffiliations,journalTitle,pubYear,isOpenAccess,keywords,nationalPriorities,healthCategories,abstract,urls
31774502,https://doi.org/10.1093/ehjcvp/pvz071,An observational study of INR control according to NICE criteria in patients with non-valvular atrial fibrillation-The SAIL Warfarin Out of Range Descriptors Study (SWORDS),An observational study of INR control according to NICE criteria in patients with non-valvular atrial fibrillation-The SAIL Warfarin Out of Range Descriptors Study (SWORDS).,"Harris DE, Thayer D, Wang T, Brooks C, Murley G, Gravenor M, Hill NR, Lister S, Halcox J.",,European heart journal. Cardiovascular pharmacotherapy,2019,N,,Improving Public Health,,"AIMS:In patients with non-valvular atrial fibrillation (NVAF) prescribed warfarin, the UK National Institute of Health and Care Excellence (NICE) defines poor anticoagulation as a TTR of < 65%, any 2 INRs within a 6 month period of ≤ 1.5 (""low""), 2 INRs ≥5 within 6months, or any INR ≥ 8 (""high"").Our objectives were to (i) quantify the number of patients with poor INR control and (ii) describe the demographic and clinical characteristics associated with poor INR control. METHOD AND RESULTS:Linked anonymised health record data for Wales (2006-2017) was used to evaluate patients prescribed warfarin who had at least 6 months of INR data.32,380 patients were included. In total, 13,913 (43.0%) patients had at least one of the NICE markers of poor INR control. Importantly, in the 24,123 (74.6%) of the cohort with an acceptable TTR (≥65%), 5,676 (23.5%) had either low or high INR readings at some point in their history. In a multivariable regression female gender, age (≥75), excess alcohol, diabetes heart failure, ischaemic heart disease and respiratory disease were independently associated with all markers of poor INR control. CONCLUSION:Acceptable INR control according to NICE standards is poor. Of those with an acceptable TTR (>65%) one quarter still had unacceptably low or high INR levels according to NICE criteria. Thus, only using TTR to assess effectiveness with warfarin has the potential to miss a large number of patients with non-therapeutic INRs who are likely to be at increased risk.",doi:https://doi.org/10.1093/ehjcvp/pvz071
31770382,https://doi.org/10.1371/journal.pmed.1002974,"Long-term mortality in mothers of infants with neonatal abstinence syndrome: A population-based parallel-cohort study in England and Ontario, Canada","Long-term mortality in mothers of infants with neonatal abstinence syndrome: A population-based parallel-cohort study in England and Ontario, Canada.","Guttmann A, Blackburn R, Amartey A, Zhou L, Wijlaars L, Saunders N, Harron K, Chiu M, Gilbert R.",,PLoS medicine,2019,Y,,Improving Public Health,,"BACKGROUND:Opioid addiction is a major public health threat to healthy life expectancy; however, little is known of long-term mortality for mothers with opioid use in pregnancy. Pregnancy and delivery care are opportunities to improve access to addiction and supportive services. Treating neonatal abstinence syndrome (NAS) as a marker of opioid use during pregnancy, this study reports long-term maternal mortality among mothers with a birth affected by NAS in relation to that of mothers without a NAS-affected birth in 2 high-prevalence jurisdictions, England and Ontario, Canada. METHODS AND FINDINGS:We conducted a population-based study using linked administrative health data to develop parallel cohorts of mother-infant dyads in England and Ontario between 2002 and 2012. The study population comprised 13,577 and 4,966 mothers of infants with NAS and 4,205,675 and 929,985 control mothers in England and Ontario, respectively. Death records captured all-cause maternal mortality after delivery through March 31, 2016, and cause-specific maternal mortality to December 31, 2014. The primary exposure was a live birth of an infant with NAS, and the main outcome was all deaths among mothers following their date of delivery. We modelled the association between NAS and all-cause maternal mortality using Cox regression, and the cumulative incidence of cause-specific mortality within a competing risks framework. All-cause mortality rates, 10-year cumulative incidence risk of death, and crude and age-adjusted hazard ratios were calculated. Estimated crude 10-year mortality based on Kaplan-Meier curves in mothers of infants with NAS was 5.1% (95% CI 4.7%-5.6%) in England and 4.6% (95% CI 3.8%-5.5%) in Ontario versus 0.4% (95% CI 0.41%-0.42%) in England and 0.4% (95% CI 0.38%-0.41%) in Ontario for controls (p < 0.001 for all comparisons). Survival curves showed no clear inflection point or period of heightened risk. The crude hazard ratio for all-cause mortality was 12.1 (95% 11.1-13.2; p < 0.001) in England and 11.4 (9.7-13.4; p < 0.001) in Ontario; age adjustment did not reduce the hazard ratios. The cumulative incidence of death was higher among NAS mothers than controls for almost all causes of death. The majority of deaths were by avoidable causes, defined as those that are preventable, amenable to care, or both. Limitations included lack of direct measures of maternal opioid use, other substance misuse, and treatments or supports received. CONCLUSIONS:In this study, we found that approximately 1 in 20 mothers of infants with NAS died within 10 years of delivery in both England and Canada-a mortality risk 11-12 times higher than for control mothers. Risk of death was not limited to the early postpartum period targeted by most public health programs. Policy responses to the current opioid epidemic require effective strategies for long-term support to improve the health and welfare of opioid-using mothers and their children.",doi:https://doi.org/10.1371/journal.pmed.1002974; html:https://europepmc.org/articles/PMC6879118; pdf:https://europepmc.org/articles/PMC6879118?pdf=render
PPR101735,https://doi.org/10.1101/19011643,Semantic computational analysis of anticoagulation use in atrial fibrillation from real world data,Semantic computational analysis of anticoagulation use in atrial fibrillation from real world data,"Bean D, Teo J, Wu H, Oliveira R, Patel R, Bendayan R, Shah AM, Dobson RJ, Scott PA.",,No Journal Info,2019,N,,Applied Analytics,,"Atrial fibrillation (AF) is the most common arrhythmia and significantly increases stroke risk. This risk is effectively managed by oral anticoagulation. Recent studies using national registry data indicate increased use of anticoagulation resulting from changes in guidelines and the availability of newer drugs. The aim of this study is to develop and validate an open source risk scoring pipeline for free-text electronic health record data using natural language processing. AF patients discharged from 1st January 2011 to 1st October 2017 were identified from discharge summaries (N=10,030, 64.6% male, average age 75.3 ± 12.3 years). A natural language processing pipeline was developed to identify risk factors in clinical text and calculate risk for ischaemic stroke (CHA2DS2-VASc) and bleeding (HAS-BLED). Scores were validated vs two independent experts for 40 patients. Automatic risk scores were in strong agreement with the two independent experts for CHA2DS2-VASc (average kappa 0.78 vs experts, compared to 0.85 between experts). Agreement was lower for HAS-BLED (average kappa 0.54 vs experts, compared to 0.74 between experts). In high-risk patients (CHA2DS2-VASc >2) OAC use has increased significantly over the last 7 years, driven by the availability of DOACs and the transitioning of patients from AP medication alone to OAC. Factors independently associated with OAC use included components of the CHA2DS2-VASc and HAS-BLED scores as well as discharging specialty and frailty. OAC use was highest in patients discharged under cardiology (69%). Electronic health record text can be used for automatic calculation of clinical risk scores at scale. Open source tools are available today for this task but require further validation. Analysis of routinely-collected EHR data can replicate findings from large-scale curated registries.",doi:https://doi.org/10.1101/19011643
31757986,https://doi.org/10.1038/s41598-019-53454-1,Ontology-based prediction of cancer driver genes,Ontology-based prediction of cancer driver genes.,"Althubaiti S, Karwath A, Dallol A, Noor A, Alkhayyat SS, Alwassia R, Mineta K, Gojobori T, Beggs AD, Schofield PN, Gkoutos GV, Hoehndorf R.",,Scientific reports,2019,Y,,Applied Analytics,,"Identifying and distinguishing cancer driver genes among thousands of candidate mutations remains a major challenge. Accurate identification of driver genes and driver mutations is critical for advancing cancer research and personalizing treatment based on accurate stratification of patients. Due to inter-tumor genetic heterogeneity many driver mutations within a gene occur at low frequencies, which make it challenging to distinguish them from non-driver mutations. We have developed a novel method for identifying cancer driver genes. Our approach utilizes multiple complementary types of information, specifically cellular phenotypes, cellular locations, functions, and whole body physiological phenotypes as features. We demonstrate that our method can accurately identify known cancer driver genes and distinguish between their role in different types of cancer. In addition to confirming known driver genes, we identify several novel candidate driver genes. We demonstrate the utility of our method by validating its predictions in nasopharyngeal cancer and colorectal cancer using whole exome and whole genome sequencing.",doi:https://doi.org/10.1038/s41598-019-53454-1; html:https://europepmc.org/articles/PMC6874647; pdf:https://europepmc.org/articles/PMC6874647?pdf=render
32554474,https://doi.org/10.1136/bmj.m2225,Association of troponin level and age with mortality in 250 000 patients: cohort study across five UK acute care centres,Association of troponin level and age with mortality in 250 000 patients: cohort study across five UK acute care centres.,,,BMJ (Clinical research ed.),2020,N,,Understanding the Causes of Disease,,,doi:https://doi.org/10.1136/bmj.m2225
31744503,https://doi.org/10.1186/s12916-019-1438-y,"Bleeding in cardiac patients prescribed antithrombotic drugs: electronic health record phenotyping algorithms, incidence, trends and prognosis","Bleeding in cardiac patients prescribed antithrombotic drugs: electronic health record phenotyping algorithms, incidence, trends and prognosis.","Pasea L, Chung SC, Pujades-Rodriguez M, Shah AD, Alvarez-Madrazo S, Allan V, Teo JT, Bean D, Sofat R, Dobson R, Banerjee A, Patel RS, Timmis A, Denaxas S, Hemingway H.",,BMC medicine,2019,Y,Phenotype; Bleeding; Prognosis; Antithrombotic Therapy; Electronic Health Records,The Human Phenome,,"BACKGROUND:Clinical guidelines and public health authorities lack recommendations on scalable approaches to defining and monitoring the occurrence and severity of bleeding in populations prescribed antithrombotic therapy. METHODS:We examined linked primary care, hospital admission and death registry electronic health records (CALIBER 1998-2010, England) of patients with newly diagnosed atrial fibrillation, acute myocardial infarction, unstable angina or stable angina with the aim to develop algorithms for bleeding events. Using the developed bleeding phenotypes, Kaplan-Meier plots were used to estimate the incidence of bleeding events and we used Cox regression models to assess the prognosis for all-cause mortality, atherothrombotic events and further bleeding. RESULTS:We present electronic health record phenotyping algorithms for bleeding based on bleeding diagnosis in primary or hospital care, symptoms, transfusion, surgical procedures and haemoglobin values. In validation of the phenotype, we estimated a positive predictive value of 0.88 (95% CI 0.64, 0.99) for hospitalised bleeding. Amongst 128,815 patients, 27,259 (21.2%) had at least 1 bleeding event, with 5-year risks of bleeding of 29.1%, 21.9%, 25.3% and 23.4% following diagnoses of atrial fibrillation, acute myocardial infarction, unstable angina and stable angina, respectively. Rates of hospitalised bleeding per 1000 patients more than doubled from 1.02 (95% CI 0.83, 1.22) in January 1998 to 2.68 (95% CI 2.49, 2.88) in December 2009 coinciding with the increased rates of antiplatelet and vitamin K antagonist prescribing. Patients with hospitalised bleeding and primary care bleeding, with or without markers of severity, were at increased risk of all-cause mortality and atherothrombotic events compared to those with no bleeding. For example, the hazard ratio for all-cause mortality was 1.98 (95% CI 1.86, 2.11) for primary care bleeding with markers of severity and 1.99 (95% CI 1.92, 2.05) for hospitalised bleeding without markers of severity, compared to patients with no bleeding. CONCLUSIONS:Electronic health record bleeding phenotyping algorithms offer a scalable approach to monitoring bleeding in the population. Incidence of bleeding has doubled in incidence since 1998, affects one in four cardiovascular disease patients, and is associated with poor prognosis. Efforts are required to tackle this iatrogenic epidemic.",doi:https://doi.org/10.1186/s12916-019-1438-y; html:https://europepmc.org/articles/PMC6864929; pdf:https://europepmc.org/articles/PMC6864929?pdf=render
31748543,https://doi.org/10.1038/s41398-019-0613-4,Identification of novel common variants associated with chronic pain using conditional false discovery rate analysis with major depressive disorder and assessment of pleiotropic effects of LRFN5,Identification of novel common variants associated with chronic pain using conditional false discovery rate analysis with major depressive disorder and assessment of pleiotropic effects of LRFN5.,"Johnston KJA, Adams MJ, Nicholl BI, Ward J, Strawbridge RJ, McIntosh AM, Smith DJ, Bailey MES.",,Translational psychiatry,2019,Y,,Understanding the Causes of Disease,,"Chronic pain is a complex trait that is moderately heritable and genetically, as well as phenotypically, correlated with major depressive disorder (MDD). Use of the conditional false discovery rate (cFDR) approach, which leverages pleiotropy identified from existing GWAS outputs, has been successful in discovering novel associated variants in related phenotypes. Here, genome-wide association study outputs for both von Korff chronic pain grade and for MDD were used to identify variants meeting a cFDR threshold for each outcome phenotype separately, as well as a conjunctional cFDR (ccFDR) threshold for both phenotypes together. Using a moderately conservative threshold, we identified a total of 11 novel single nucleotide polymorphisms (SNPs), six of which were associated with chronic pain grade and nine of which were associated with MDD. Four SNPs on chromosome 14 were associated with both chronic pain grade and MDD. SNPs associated only with chronic pain grade were located within SLC16A7 on chromosome 12. SNPs associated only with MDD were located either in a gene-dense region on chromosome 1 harbouring LINC01360, LRRIQ3, FPGT and FPGT-TNNI3K, or within/close to LRFN5 on chromosome 14. The SNPs associated with both outcomes were also located within LRFN5. Several of the SNPs on chromosomes 1 and 14 were identified as being associated with expression levels of nearby genes in the brain and central nervous system. Overall, using the cFDR approach, we identified several novel genetic loci associated with chronic pain and we describe likely pleiotropic effects of a recently identified MDD locus on chronic pain.",doi:https://doi.org/10.1038/s41398-019-0613-4; html:https://europepmc.org/articles/PMC6868167; pdf:https://europepmc.org/articles/PMC6868167?pdf=render
31233103,https://doi.org/10.1093/bioinformatics/btz469,PhenoScanner V2: an expanded tool for searching human genotype-phenotype associations,PhenoScanner V2: an expanded tool for searching human genotype-phenotype associations.,"Kamat MA, Blackshaw JA, Young R, Surendran P, Burgess S, Danesh J, Butterworth AS, Staley JR.",,"Bioinformatics (Oxford, England)",2019,Y,,Applied Analytics,,"SUMMARY:PhenoScanner is a curated database of publicly available results from large-scale genetic association studies in humans. This online tool facilitates 'phenome scans', where genetic variants are cross-referenced for association with many phenotypes of different types. Here we present a major update of PhenoScanner ('PhenoScanner V2'), including over 150 million genetic variants and more than 65 billion associations (compared to 350 million associations in PhenoScanner V1) with diseases and traits, gene expression, metabolite and protein levels, and epigenetic markers. The query options have been extended to include searches by genes, genomic regions and phenotypes, as well as for genetic variants. All variants are positionally annotated using the Variant Effect Predictor and the phenotypes are mapped to Experimental Factor Ontology terms. Linkage disequilibrium statistics from the 1000 Genomes project can be used to search for phenotype associations with proxy variants. AVAILABILITY AND IMPLEMENTATION:PhenoScanner V2 is available at www.phenoscanner.medschl.cam.ac.uk.",doi:https://doi.org/10.1093/bioinformatics/btz469; html:https://europepmc.org/articles/PMC6853652; pdf:https://europepmc.org/articles/PMC6853652?pdf=render
31711543,https://doi.org/10.1186/s13326-019-0214-4,Natural language processing for disease phenotyping in UK primary care records for research: a pilot study in myocardial infarction and death,Natural language processing for disease phenotyping in UK primary care records for research: a pilot study in myocardial infarction and death.,"Shah AD, Bailey E, Williams T, Denaxas S, Dobson R, Hemingway H.",,Journal of biomedical semantics,2019,Y,Myocardial infarction; Chest pain; Primary Care; Natural Language Processing; Free Text,Applied Analytics,,"BACKGROUND:Free text in electronic health records (EHR) may contain additional phenotypic information beyond structured (coded) information. For major health events - heart attack and death - there is a lack of studies evaluating the extent to which free text in the primary care record might add information. Our objectives were to describe the contribution of free text in primary care to the recording of information about myocardial infarction (MI), including subtype, left ventricular function, laboratory results and symptoms; and recording of cause of death. We used the CALIBER EHR research platform which contains primary care data from the Clinical Practice Research Datalink (CPRD) linked to hospital admission data, the MINAP registry of acute coronary syndromes and the death registry. In CALIBER we randomly selected 2000 patients with MI and 1800 deaths. We implemented a rule-based natural language engine, the Freetext Matching Algorithm, on site at CPRD to analyse free text in the primary care record without raw data being released to researchers. We analysed text recorded within 90 days before or 90 days after the MI, and on or after the date of death. RESULTS:We extracted 10,927 diagnoses, 3658 test results, 3313 statements of negation, and 850 suspected diagnoses from the myocardial infarction patients. Inclusion of free text increased the recorded proportion of patients with chest pain in the week prior to MI from 19 to 27%, and differentiated between MI subtypes in a quarter more patients than structured data alone. Cause of death was incompletely recorded in primary care; in 36% the cause was in coded data and in 21% it was in free text. Only 47% of patients had exactly the same cause of death in primary care and the death registry, but this did not differ between coded and free text causes of death. CONCLUSIONS:Among patients who suffer MI or die, unstructured free text in primary care records contains much information that is potentially useful for research such as symptoms, investigation results and specific diagnoses. Access to large scale unstructured data in electronic health records (millions of patients) might yield important insights.",doi:https://doi.org/10.1186/s13326-019-0214-4; html:https://europepmc.org/articles/PMC6849160; pdf:https://europepmc.org/articles/PMC6849160?pdf=render
31730918,https://doi.org/10.1016/j.jclinepi.2019.11.006,Data mining information from electronic health records produced high yield and accuracy for current smoking status,Data mining information from electronic health records produced high yield and accuracy for current smoking status.,"Groenhof TKJ, Koers LR, Blasse E, de Groot M, Grobbee DE, Bots ML, Asselbergs FW, Lely AT, Haitjema S, UPOD, UCC-CVRM Study Groups.",,Journal of clinical epidemiology,2020,N,data mining; Data Quality; Electronic Health Records; Text Mining; Learning Healthcare System; Routine Clinical Data,The Human Phenome,,"OBJECTIVES:Researchers are increasingly using routine clinical data for care evaluations and feedback to patients and clinicians. The quality of these evaluations depends on the quality and completeness of the input data. STUDY DESIGN AND SETTING:We assessed the performance of an electronic health record (EHR)-based data mining algorithm, using the example of the smoking status in a cardiovascular population. As a reference standard, we used the questionnaire from the Utrecht Cardiovascular Cohort (UCC). To assess diagnostic accuracy, we calculated sensitivity, specificity, negative predictive value (NPV), and positive predictive value (PPV). RESULTS:We analyzed 1,661 patients included in the UCC to January 18, 2019. Of those, 14% (n = 238) had missing information on smoking status in the UCC questionnaire. Data mining provided information on smoking status in 99% of the 1,661 participants. Diagnostic accuracy for current smoking was sensitivity 88%, specificity 92%, NPV 98%, and PPV 63%. From false positives, 85% reported they had quit smoking at the time of the UCC. CONCLUSION:Data mining showed great potential in retrieving information on smoking (a near complete yield). Its diagnostic performance is good for negative smoking statuses. The implications of misclassification with data mining are dependent on the application of the data.",doi:https://doi.org/10.1016/j.jclinepi.2019.11.006
32046816,https://doi.org/10.2807/1560-7917.es.2020.25.5.2000080,Effectiveness of airport screening at detecting travellers infected with novel coronavirus (2019-nCoV).,Effectiveness of airport screening at detecting travellers infected with novel coronavirus (2019-nCoV).,"Quilty BJ, Clifford S, Flasche S, Eggo RM, CMMID nCoV working group.",,Euro surveillance : bulletin Europeen sur les maladies transmissibles = European communicable disease bulletin,2020,Y,Surveillance; Effectiveness; Interventions; Emerging Infections; 2019-Ncov; Airport Screening; Thermal Scanning,,,"We evaluated effectiveness of thermal passenger screening for 2019-nCoV infection at airport exit and entry to inform public health decision-making. In our baseline scenario, we estimated that 46% (95% confidence interval: 36 to 58) of infected travellers would not be detected, depending on incubation period, sensitivity of exit and entry screening, and proportion of asymptomatic cases. Airport screening is unlikely to detect a sufficient proportion of 2019-nCoV infected travellers to avoid entry of infected travellers.",doi:https://doi.org/10.2807/1560-7917.ES.2020.25.5.2000080; html:https://europepmc.org/articles/PMC7014668; pdf:https://europepmc.org/articles/PMC7014668?pdf=render
