id,doi,originalTitle,title,authorString,authorAffiliations,journalTitle,pubYear,isOpenAccess,keywords,nationalPriorities,healthCategories,abstract,urls
31995663,https://doi.org/10.1111/cts.12725,Using Real-World Data to Guide Ustekinumab Dosing Strategies for Psoriasis: A Prospective Pharmacokinetic-Pharmacodynamic Study,Using Real-World Data to Guide Ustekinumab Dosing Strategies for Psoriasis: A Prospective Pharmacokinetic-Pharmacodynamic Study.,"Pan S, Tsakok T, Dand N, Lonsdale DO, Loeff FC, Bloem K, de Vries A, Baudry D, Duckworth M, Mahil S, Pushpa-Rajah A, Russell A, Alsharqi A, Becher G, Murphy R, Wahie S, Wright A, Griffiths CEM, Reynolds NJ, Barker J, Warren RB, David Burden A, Rispens T, Standing JF, Smith CH, BADBIR Study Group, the BSTOP Study Group, the PSORT Consortium.",,Clinical and translational science,2020,Y,,,skin,"Variation in response to biologic therapy for inflammatory diseases, such as psoriasis, is partly driven by variation in drug exposure. Real-world psoriasis data were used to develop a pharmacokinetic/pharmacodynamic (PK/PD) model for the first-line therapeutic antibody ustekinumab. The impact of differing dosing strategies on response was explored. Data were collected from a UK prospective multicenter observational cohort (491 patients on ustekinumab monotherapy, drug levels, and anti-drug antibody measurements on 797 serum samples, 1,590 measurements of Psoriasis Area Severity Index (PASI)). Ustekinumab PKs were described with a linear one-compartment model. A maximum effect (Emax ) model inhibited progression of psoriatic skin lesions in the turnover PD mechanism describing PASI evolution while on treatment. A mixture model on half-maximal effective concentration identified a potential nonresponder group, with simulations suggesting that, in future, the model could be incorporated into a Bayesian therapeutic drug monitoring ""dashboard"" to individualize dosing and improve treatment outcomes.",doi:https://doi.org/10.1111/cts.12725; html:https://europepmc.org/articles/PMC7070790; pdf:https://europepmc.org/articles/PMC7070790?pdf=render
30887727,https://doi.org/10.1002/ppul.24314,Physical activity among children with asthma: Cross-sectional analysis in the UK millennium cohort,Physical activity among children with asthma: Cross-sectional analysis in the UK millennium cohort.,"Pike KC, Griffiths LJ, Dezateux C, Pearce A.",,Pediatric pulmonology,2019,Y,Children; Cohort study; epidemiology; Physical Activity; Asthma And Early Wheeze,Improving Public Health,,"BACKGROUND:Although beneficial for health and well-being, most children do not achieve recommended levels of physical activity. Evidence for children with asthma is mixed, with symptom severity rarely considered. This paper aimed to address this gap. METHODS:We analyzed cross-sectional associations between physical activity and parent-reported asthma symptoms and severity for 6497 UK Millennium Cohort Study 7-year-old participants (3321, [49%] girls). Primary outcomes were daily moderate-to-vigorous physical activity (MVPA, minutes) and proportion of children achieving recommended minimum daily levels of 60 minutes of MVPA. Daily steps, sedentary time, and total activity counts per minute (cpm) were recorded, as were parent-reported asthma symptoms, medications, and recent hospital admissions. Associations were investigated using quantile (continuous outcomes) and Poisson (binary outcomes) regression, adjusting for demographic, socioeconomic, health, and environmental factors. RESULTS:Neither asthma status nor severity was associated with MVPA; children recently hospitalized for asthma were less likely to achieve recommended daily MVPA (risk ratio [95% confidence interval [CI]]: 0.67 [0.44, 1.03]). Recent wheeze, current asthma, and severe asthma symptoms were associated with fewer sedentary hours (difference in medians [95% CI]: -0.18 [-0.27, -0.08]; -0.14 [-0.24, -0.05]; -0.15, [-0.28, -0.02], respectively) and hospital admission with lower total activity (-48 cpm [-68, -28]). CONCLUSION:Children with asthma are as physically active as their asthma-free counterparts, while those recently hospitalized for asthma are less active. Qualitative studies are needed to understand the perceptions of children and families about physical activity following hospital admission and to inform support and advice needed to maintain active lifestyles for children with asthma.",doi:https://doi.org/10.1002/ppul.24314; html:https://europepmc.org/articles/PMC6617805; pdf:https://europepmc.org/articles/PMC6617805?pdf=render
30879893,https://doi.org/10.1016/s1474-4422(18)30499-x,"Global, regional, and national burden of neurological disorders, 1990-2016: a systematic analysis for the Global Burden of Disease Study 2016","Global, regional, and national burden of neurological disorders, 1990-2016: a systematic analysis for the Global Burden of Disease Study 2016.",GBD 2016 Neurology Collaborators.,,The Lancet. Neurology,2019,Y,,Improving Public Health,,"BACKGROUND:Neurological disorders are increasingly recognised as major causes of death and disability worldwide. The aim of this analysis from the Global Burden of Diseases, Injuries, and Risk Factors Study (GBD) 2016 is to provide the most comprehensive and up-to-date estimates of the global, regional, and national burden from neurological disorders. METHODS:We estimated prevalence, incidence, deaths, and disability-adjusted life-years (DALYs; the sum of years of life lost [YLLs] and years lived with disability [YLDs]) by age and sex for 15 neurological disorder categories (tetanus, meningitis, encephalitis, stroke, brain and other CNS cancers, traumatic brain injury, spinal cord injury, Alzheimer's disease and other dementias, Parkinson's disease, multiple sclerosis, motor neuron diseases, idiopathic epilepsy, migraine, tension-type headache, and a residual category for other less common neurological disorders) in 195 countries from 1990 to 2016. DisMod-MR 2.1, a Bayesian meta-regression tool, was the main method of estimation of prevalence and incidence, and the Cause of Death Ensemble model (CODEm) was used for mortality estimation. We quantified the contribution of 84 risks and combinations of risk to the disease estimates for the 15 neurological disorder categories using the GBD comparative risk assessment approach. FINDINGS:Globally, in 2016, neurological disorders were the leading cause of DALYs (276 million [95% UI 247-308]) and second leading cause of deaths (9·0 million [8·8-9·4]). The absolute number of deaths and DALYs from all neurological disorders combined increased (deaths by 39% [34-44] and DALYs by 15% [9-21]) whereas their age-standardised rates decreased (deaths by 28% [26-30] and DALYs by 27% [24-31]) between 1990 and 2016. The only neurological disorders that had a decrease in rates and absolute numbers of deaths and DALYs were tetanus, meningitis, and encephalitis. The four largest contributors of neurological DALYs were stroke (42·2% [38·6-46·1]), migraine (16·3% [11·7-20·8]), Alzheimer's and other dementias (10·4% [9·0-12·1]), and meningitis (7·9% [6·6-10·4]). For the combined neurological disorders, age-standardised DALY rates were significantly higher in males than in females (male-to-female ratio 1·12 [1·05-1·20]), but migraine, multiple sclerosis, and tension-type headache were more common and caused more burden in females, with male-to-female ratios of less than 0·7. The 84 risks quantified in GBD explain less than 10% of neurological disorder DALY burdens, except stroke, for which 88·8% (86·5-90·9) of DALYs are attributable to risk factors, and to a lesser extent Alzheimer's disease and other dementias (22·3% [11·8-35·1] of DALYs are risk attributable) and idiopathic epilepsy (14·1% [10·8-17·5] of DALYs are risk attributable). INTERPRETATION:Globally, the burden of neurological disorders, as measured by the absolute number of DALYs, continues to increase. As populations are growing and ageing, and the prevalence of major disabling neurological disorders steeply increases with age, governments will face increasing demand for treatment, rehabilitation, and support services for neurological disorders. The scarcity of established modifiable risks for most of the neurological burden demonstrates that new knowledge is required to develop effective prevention and treatment strategies. FUNDING:Bill & Melinda Gates Foundation.",doi:https://doi.org/10.1016/S1474-4422(18)30499-X; html:https://europepmc.org/articles/PMC6459001; pdf:https://europepmc.org/articles/PMC6459001?pdf=render
30949070,https://doi.org/10.3389/fpsyt.2019.00109,Real World Implementation of a Transdiagnostic Risk Calculator for the Automatic Detection of Individuals at Risk of Psychosis in Clinical Routine: Study Protocol,Real World Implementation of a Transdiagnostic Risk Calculator for the Automatic Detection of Individuals at Risk of Psychosis in Clinical Routine: Study Protocol.,"Fusar-Poli P, Oliver D, Spada G, Patel R, Stewart R, Dobson R, McGuire P.",,Frontiers in psychiatry,2019,Y,Schizophrenia; Prevention; risk; Psychosis; Transdiagnostic,"Applied Analytics, Better Care",,"Background: Primary indicated prevention in individuals at-risk for psychosis has the potential to improve the outcomes of this disorder. The ability to detect the majority of at-risk individuals is the main barrier toward extending benefits for the lives of many adolescents and young adults. Current detection strategies are highly inefficient. Only 5% (standalone specialized early detection services) to 12% (youth mental health services) of individuals who will develop a first psychotic disorder can be detected at the time of their at-risk stage. To overcome these challenges a pragmatic, clinically-based, individualized, transdiagnostic risk calculator has been developed to detect individuals at-risk of psychosis in secondary mental health care at scale. This calculator has been externally validated and has demonstrated good prognostic performance. However, it is not known whether it can be used in the real world clinical routine. For example, clinicians may not be willing to adhere to the recommendations made by the transdiagnostic risk calculator. Implementation studies are needed to address pragmatic challenges relating to the real world use of the transdiagnostic risk calculator. The aim of the current study is to provide in-vitro and in-vivo feasibility data to support the implementation of the transdiagnostic risk calculator in clinical routine. Method: This is a study which comprises of two subsequent phases: an in-vitro phase of 1 month and an in-vivo phase of 11 months. The in-vitro phase aims at developing and integrating the transdiagnostic risk calculator in the local electronic health register (primary outcome). The in-vivo phase aims at addressing the clinicians' adherence to the recommendations made by the transdiagnostic risk calculator (primary outcome) and other secondary feasibility parameters that are necessary to estimate the resources needed for its implementation. Discussion: This is the first implementation study for risk prediction models in individuals at-risk for psychosis. Ultimately, successful implementation is the true measure of a prediction model's utility. Therefore, the overall translational deliverable of the current study would be to extend the benefits of primary indicated prevention and improve outcomes of first episode psychosis. This may produce significant social benefits for many adolescents and young adults and their families.",doi:https://doi.org/10.3389/fpsyt.2019.00109; html:https://europepmc.org/articles/PMC6436079; pdf:https://europepmc.org/articles/PMC6436079?pdf=render
31650125,https://doi.org/10.1016/s2589-7500(19)30012-3,Machine-readable versions of electronic health record phenotyping algorithms for 308 physical and mental health conditions from 4 million patients,A chronological map of 308 physical and mental health conditions from 4 million individuals in the English National Health Service.,"Kuan V, Denaxas S, Gonzalez-Izquierdo A, Direk K, Bhatti O, Husain S, Sutaria S, Hingorani M, Nitsch D, Parisinos CA, Lumbers RT, Mathur R, Sofat R, Casas JP, Wong ICK, Hemingway H, Hingorani AD.",,The Lancet. Digital health,2019,Y,,The Human Phenome,,"Background:To effectively prevent, detect, and treat health conditions that affect people during their lifecourse, health-care professionals and researchers need to know which sections of the population are susceptible to which health conditions and at which ages. Hence, we aimed to map the course of human health by identifying the 50 most common health conditions in each decade of life and estimating the median age at first diagnosis. Methods:We developed phenotyping algorithms and codelists for physical and mental health conditions that involve intensive use of health-care resources. Individuals older than 1 year were included in the study if their primary-care and hospital-admission records met research standards set by the Clinical Practice Research Datalink and they had been registered in a general practice in England contributing up-to-standard data for at least 1 year during the study period. We used linked records of individuals from the CALIBER platform to calculate the sex-standardised cumulative incidence for these conditions by 10-year age groups between April 1, 2010, and March 31, 2015. We also derived the median age at diagnosis and prevalence estimates stratified by age, sex, and ethnicity (black, white, south Asian) over the study period from the primary-care and secondary-care records of patients. Findings:We developed case definitions for 308 disease phenotypes. We used records of 2 784 138 patients for the calculation of cumulative incidence and of 3 872 451 patients for the calculation of period prevalence and median age at diagnosis of these conditions. Conditions that first gained prominence at key stages of life were: atopic conditions and infections that led to hospital admission in children (<10 years); acne and menstrual disorders in the teenage years (10-19 years); mental health conditions, obesity, and migraine in individuals aged 20-29 years; soft-tissue disorders and gastro-oesophageal reflux disease in individuals aged 30-39 years; dyslipidaemia, hypertension, and erectile dysfunction in individuals aged 40-59 years; cancer, osteoarthritis, benign prostatic hyperplasia, cataract, diverticular disease, type 2 diabetes, and deafness in individuals aged 60-79 years; and atrial fibrillation, dementia, acute and chronic kidney disease, heart failure, ischaemic heart disease, anaemia, and osteoporosis in individuals aged 80 years or older. Black or south-Asian individuals were diagnosed earlier than white individuals for 258 (84%) of the 308 conditions. Bone fractures and atopic conditions were recorded earlier in male individuals, whereas female individuals were diagnosed at younger ages with nutritional anaemias, tubulointerstitial nephritis, and urinary disorders. Interpretation:We have produced the first chronological map of human health with cumulative-incidence and period-prevalence estimates for multiple morbidities in parallel from birth to advanced age. This can guide clinicians, policy makers, and researchers on how to formulate differential diagnoses, allocate resources, and target research priorities on the basis of the knowledge of who gets which diseases when. We have published our phenotyping algorithms on the CALIBER open-access Portal which will facilitate future research by providing a curated list of reusable case definitions. Funding:Wellcome Trust, National Institute for Health Research, Medical Research Council, Arthritis Research UK, British Heart Foundation, Cancer Research UK, Chief Scientist Office of the Scottish Government Health and Social Care Directorates, Department of Health and Social Care (England), Health and Social Care Research and Development Division (Welsh Government), Public Health Agency (Northern Ireland), Economic and Social Research Council, Engineering and Physical Sciences Research Council, National Institute for Social Care and Health Research, and The Alan Turing Institute.",doi:https://doi.org/10.1016/S2589-7500(19)30012-3; html:https://europepmc.org/articles/PMC6798263; pdf:https://europepmc.org/articles/PMC6798263?pdf=render
PPR72765,https://doi.org/10.12688/wellcomeopenres.15151.1,Causes of death among homeless people: a population-based cross-sectional study of linked hospitalisation and mortality data in England,Causes of death among homeless people: a population-based cross-sectional study of linked hospitalisation and mortality data in England.,"Aldridge RW, Menezes D, Lewer D, Cornes M, Evans H, Blackburn RM, Byng R, Clark M, Denaxas S, Fuller J, Hewett N, Kilmister A, Luchenski S, Manthorpe J, McKee M, Neale J, Story A, Tinelli M, Whiteford M, Wurie F, Hayward A.",,No Journal Info,2019,N,,Improving Public Health,,"Background : Homelessness has increased by 165% since 2010 in England, with evidence from many settings that those affected experience high levels of mortality. In this paper we examine the contribution of different causes of death to overall mortality in homeless people recently admitted to hospitals in England with specialist integrated homeless health and care (SIHHC) schemes.  Methods : We undertook an analysis of linked hospital admission records and mortality data for people attending any one of 17 SIHHC schemes between 1st November 2013 and 30th November 2016. Our primary outcome was death, which we analysed in subgroups of 10th version international classification of disease (ICD-10) specific deaths; and deaths from amenable causes. We compared our results to a sample of people living in areas of high social deprivation (IMD5 group). Results : We collected data on 3,882 individual homeless hospital admissions that were linked to 600 deaths. The median age of death was 51.6 years (interquartile range 42.7-60.2) for SIHHC and 71.5 for the IMD5 (60.67-79.0).  The top three underlying causes of death by ICD-10 chapter in the SIHHC group were external causes of death (21.7%; 130/600), cancer (19.0%; 114/600) and digestive disease (19.0%; 114/600).  The percentage of deaths due to an amenable cause after age and sex weighting was 30.2% in the homeless SIHHC group (181/600) compared to 23.0% in the IMD5 group (578/2,512). Conclusion : Nearly one in three homeless deaths were due to causes amenable to timely and effective health care. The high burden of amenable deaths highlights the extreme health harms of homelessness and the need for greater emphasis on prevention of homelessness and early healthcare interventions.",doi:https://doi.org/10.12688/wellcomeopenres.15151.1
30835202,https://doi.org/10.7554/elife.43657,An atlas of polygenic risk score associations to highlight putative causal relationships across the human phenome,An atlas of polygenic risk score associations to highlight putative causal relationships across the human phenome.,"Richardson TG, Harrison S, Hemani G, Davey Smith G.",,eLife,2019,Y,Human; Genetics; Genomics; Causal Inference; Mendelian Randomization; Genetic Liability; Phenome-wide Association Study; Polygenic Risk Scores,The Human Phenome,,"The age of large-scale genome-wide association studies (GWAS) has provided us with an unprecedented opportunity to evaluate the genetic liability of complex disease using polygenic risk scores (PRS). In this study, we have analysed 162 PRS (p<5×10-05) derived from GWAS and 551 heritable traits from the UK Biobank study (N = 334,398). Findings can be investigated using a web application (http:‌//‌mrcieu.‌mrsoftware.org/‌PRS‌_atlas/), which we envisage will help uncover both known and novel mechanisms which contribute towards disease susceptibility. To demonstrate this, we have investigated the results from a phenome-wide evaluation of schizophrenia genetic liability. Amongst findings were inverse associations with measures of cognitive function which extensive follow-up analyses using Mendelian randomization (MR) provided evidence of a causal relationship. We have also investigated the effect of multiple risk factors on disease using mediation and multivariable MR frameworks. Our atlas provides a resource for future endeavours seeking to unravel the causal determinants of complex disease.",doi:https://doi.org/10.7554/eLife.43657; html:https://europepmc.org/articles/PMC6400585; pdf:https://europepmc.org/articles/PMC6400585?pdf=render
30819382,https://doi.org/10.1016/j.jchf.2019.01.009,Adverse Drug Reactions to Guideline-Recommended Heart Failure Drugs in Women: A Systematic Review of the Literature,Adverse Drug Reactions to Guideline-Recommended Heart Failure Drugs in Women: A Systematic Review of the Literature.,"Bots SH, Groepenhoff F, Eikendal ALM, Tannenbaum C, Rochon PA, Regitz-Zagrosek V, Miller VM, Day D, Asselbergs FW, den Ruijter HM.",,JACC. Heart failure,2019,N,Women; Sex differences; Heart Failure; Adverse drug reactions; Sex-specific Reporting,The Human Phenome,,"OBJECTIVES:This study sought to summarize all available evidence on sex differences in adverse drug reactions (ADRs) to heart failure (HF) medication. BACKGROUND:Women are more likely to experience ADRs than men, and these reactions may negatively affect women's immediate and long-term health. HF in particular is associated with increased ADR risk because of the high number of comorbidities and older age. However, little is known about ADRs in women with HF who are treated with guideline-recommended drugs. METHODS:A systematic search of PubMed and EMBASE was performed to collect all available information on ADRs to angiotensin-converting enzyme inhibitors, β-blockers, angiotensin II receptor blockers, mineralocorticoid receptor antagonists, ivabradine, and digoxin in both women and men with HF. RESULTS:The search identified 155 eligible records, of which only 11 (7%) reported ADR data for women and men separately. Sex-stratified reporting of ADRs did not increase over the last decades. Six of the 11 studies did not report sex differences. Three studies reported a higher risk of angiotensin-converting enzyme inhibitor-related ADRs in women, 1 study showed higher digoxin-related mortality risk for women, and 1 study reported a higher risk of mineralocorticoid receptor antagonist-related ADRs in men. No sex differences in ADRs were reported for angiotensin II receptor blockers and β-blockers. Sex-stratified data were not available for ivabradine. CONCLUSIONS:These results underline the scarcity of ADR data stratified by sex. The study investigators call for a change in standard scientific practice toward reporting of ADR data for women and men separately.",doi:https://doi.org/10.1016/j.jchf.2019.01.009
30778056,https://doi.org/10.1038/s41467-019-08797-8,Towards a data-integrated cell,Towards a data-integrated cell.,"Malod-Dognin N, Petschnigg J, Windels SFL, Povh J, Hemingway H, Ketteler R, Pržulj N.",,Nature communications,2019,Y,,Applied Analytics,,"We are increasingly accumulating molecular data about a cell. The challenge is how to integrate them within a unified conceptual and computational framework enabling new discoveries. Hence, we propose a novel, data-driven concept of an integrated cell, iCell. Also, we introduce a computational prototype of an iCell, which integrates three omics, tissue-specific molecular interaction network types. We construct iCells of four cancers and the corresponding tissue controls and identify the most rewired genes in cancer. Many of them are of unknown function and cannot be identified as different in cancer in any specific molecular network. We biologically validate that they have a role in cancer by knockdown experiments followed by cell viability assays. We find additional support through Kaplan-Meier survival curves of thousands of patients. Finally, we extend this analysis to uncover pan-cancer genes. Our methodology is universal and enables integrative comparisons of diverse omics data over cells and tissues.",doi:https://doi.org/10.1038/s41467-019-08797-8; html:https://europepmc.org/articles/PMC6379402; pdf:https://europepmc.org/articles/PMC6379402?pdf=render
30814958,https://doi.org/10.3389/fpsyt.2019.00036,Risk Assessment Tools and Data-Driven Approaches for Predicting and Preventing Suicidal Behavior,Risk Assessment Tools and Data-Driven Approaches for Predicting and Preventing Suicidal Behavior.,"Velupillai S, Hadlaczky G, Baca-Garcia E, Gorrell GM, Werbeloff N, Nguyen D, Patel R, Leightley D, Downs J, Hotopf M, Dutta R.",,Frontiers in psychiatry,2019,Y,Machine Learning; Suicidality; Natural Language Processing; Clinical Informatics; Suicide Risk Assessment; Suicide Risk Prediction,Applied Analytics,,"Risk assessment of suicidal behavior is a time-consuming but notoriously inaccurate activity for mental health services globally. In the last 50 years a large number of tools have been designed for suicide risk assessment, and tested in a wide variety of populations, but studies show that these tools suffer from low positive predictive values. More recently, advances in research fields such as machine learning and natural language processing applied on large datasets have shown promising results for health care, and may enable an important shift in advancing precision medicine. In this conceptual review, we discuss established risk assessment tools and examples of novel data-driven approaches that have been used for identification of suicidal behavior and risk. We provide a perspective on the strengths and weaknesses of these applications to mental health-related data, and suggest research directions to enable improvement in clinical practice.",doi:https://doi.org/10.3389/fpsyt.2019.00036; html:https://europepmc.org/articles/PMC6381841; pdf:https://europepmc.org/articles/PMC6381841?pdf=render
